<?xml version="1.0" encoding="UTF-8"?>
<!DOCTYPE ejb-j2ee-engine SYSTEM "ejb-j2ee-engine.dtd">
<ejb-j2ee-engine>
	<enterprise-beans>
		 <enterprise-bean>
      	 	<ejb-name>RestSenderExpiredTokensDeleteJob</ejb-name>
		    <jndi-name>RestSenderExpiredTokensDeleteJob</jndi-name>
			<message-props>
				<property>
					<property-name>destination-name</property-name>
					<property-value>JobQueue</property-value>
				</property>
				<property>
					<property-name>connection-factory-name</property-name>
					<property-value>JobQueueFactory</property-value>
				</property>
			</message-props>
    	</enterprise-bean>				
	</enterprise-beans>
</ejb-j2ee-engine>
